level2_id,size,top_labels,top_types,display_label,analyst_label
0,19,Cease-fire agreement / Exchange of fire | Demonstrations in Algeria / Bourguiba's speech | Troop Withdrawal / Khrushchev's speech | Negotiation with USSR / Appointment of Prime Minister | Violence in Baghdad / Demonstrations in Baghdad | Suez talks / ABBAS PARKHIDEH | Abrogation of the 1936 Anglo-Egyptian Treaty / January riots | ADDU ATOLL / ALLIED COUNCIL FOR AUSTRIA,"{""LEVEL1_COMMUNITY"": 19}",Cease-fire agreement / Exchange of fire / Demonstrations in Algeria / Bourguiba's speech,Cold War bloc politics and strategic positioning
1,17,Negotiations in Laos / Press Conference | Visit to Moscow / Nehru's Statements | Recognition of Mongolia / Military assessment | Tananarive conference / Detention of Tshombé | Demonstrations in South Korea / Khrushchev's Visit | Dissolution of Japanese Diet / Japanese elections | Cease-fire negotiations / Artillery exchange | Colombo conference / ABDALLAH AL RIMAWI,"{""LEVEL1_COMMUNITY"": 17}",Negotiations in Laos / Press Conference / Visit to Moscow / Nehru's Statements,"Military posture, insurgency, and regime stability"
2,14,Demonstrations in Trieste / Tito's speech | Khrushchev's speech / Geneva Conference | Cabinet Meeting / Bundestag debate | Cabinet Meeting / Formation of New Government | Trade Negotiation / Interzonal Trade Agreement | Gomulka's speech / Student demonstrations | Geneva conference / ACHILLES | Rakosi's speech / Unrest in Rumania,"{""LEVEL1_COMMUNITY"": 14}",Demonstrations in Trieste / Tito's speech / Khrushchev's speech / Geneva Conference,"Government leadership, cabinet politics, and state decision-making"
3,9,Rioting in Caracas / Foray into Nicaragua | Demonstrations in Cuba / Arrest of Huber Matos | 62 GROUP / 8TH AIR DIVISION | Anti-US demonstrations / 12 NATION COMMISSION | Congress Meeting / Rioting in Guatemala | Bolivian revolt / ADRIEN OMARI | Soviet propaganda campaign / Violence in Guayaquil | Press conference / ABDUL RAHMAN BABU,"{""LEVEL1_COMMUNITY"": 9}",Rioting in Caracas / Foray into Nicaragua / Demonstrations in Cuba / Arrest of Huber Matos,Cold War bloc politics and strategic positioning
4,1,BERLIN LEADERS / FEDERAL GOVERNMENT,"{""LEVEL1_COMMUNITY"": 1}",BERLIN LEADERS / FEDERAL GOVERNMENT,"Government leadership, cabinet politics, and state decision-making"
5,1,AMERICAN OFFICIALS [COMMANDANTS / BERLIN] / BRITISH BERLIN COMMANDANTS,"{""LEVEL1_COMMUNITY"": 1}",AMERICAN OFFICIALS [COMMANDANTS / BERLIN] / BRITISH BERLIN COMMANDANTS,AMERICAN OFFICIALS [COMMANDANTS / BERLIN] / BRITISH BERLIN COMMANDANTS-centered political 
6,1,ARMY [LED / PEASANT] / COMMUNIST LED LABOR AND PEASANT GROUPS,"{""LEVEL1_COMMUNITY"": 1}",ARMY [LED / PEASANT] / COMMUNIST LED LABOR AND PEASANT GROUPS,Labor unrest and internal political pressure
